{
  "$schema": "https://json-schema.org/draft/2020-12/schema",
  "$id": "https://raw.githubusercontent.com/Natchannnn/repository-engineering-skills/main/examples/template/evidence-record.schema.json",
  "title": "EvidenceRecord",
  "description": "Schema for recording an empirical run of an AI coding agent on a reproducible skill demo fixture.",
  "type": "object",
  "required": [
    "schema_version",
    "run_id",
    "recorded_at_utc",
    "skill",
    "fixture",
    "environment",
    "execution",
    "verification_results",
    "limitations"
  ],
  "additionalProperties": false,
  "properties": {
    "$schema": {
      "type": "string"
    },
    "schema_version": {
      "type": "string",
      "const": "1.0.0"
    },
    "run_id": {
      "type": "string",
      "pattern": "^[a-zA-Z0-9_-]+$"
    },
    "recorded_at_utc": {
      "type": "string",
      "pattern": "^\\d{4}-\\d{2}-\\d{2}T\\d{2}:\\d{2}:\\d{2}Z$"
    },
    "skill": {
      "type": "object",
      "required": ["name", "source_commit", "distribution"],
      "additionalProperties": false,
      "properties": {
        "name": {
          "type": "string",
          "enum": ["repo-foundation", "repo-native-refactor"]
        },
        "source_commit": {
          "type": "string",
          "pattern": "^[0-9a-f]{40}$"
        },
        "distribution": {
          "type": "string",
          "enum": ["runtime-zip", "repo-source", "skills-cli"]
        }
      }
    },
    "fixture": {
      "type": "object",
      "required": ["name", "bootstrap_commit"],
      "additionalProperties": false,
      "properties": {
        "name": {
          "type": "string"
        },
        "bootstrap_commit": {
          "type": "string",
          "pattern": "^[0-9a-f]{40}$"
        }
      }
    },
    "environment": {
      "type": "object",
      "required": ["host", "model", "os", "python_version"],
      "additionalProperties": false,
      "properties": {
        "host": { "type": "string" },
        "model": { "type": "string" },
        "os": { "type": "string" },
        "python_version": { "type": "string" }
      }
    },
    "execution": {
      "type": "object",
      "required": ["prompt_file", "commands_executed"],
      "additionalProperties": false,
      "properties": {
        "prompt_file": { "type": "string" },
        "commands_executed": {
          "type": "array",
          "items": {
            "type": "object",
            "required": ["cmd", "exit_code"],
            "additionalProperties": false,
            "properties": {
              "cmd": { "type": "string" },
              "exit_code": { "type": "integer" }
            }
          }
        }
      }
    },
    "verification_results": {
      "type": "object",
      "required": [
        "independent_checks_passed",
        "findings_or_behavior_verified",
        "protected_state_preserved",
        "check_details"
      ],
      "additionalProperties": false,
      "properties": {
        "independent_checks_passed": {
          "type": "string",
          "enum": ["not_run", "pass", "fail"],
          "description": "Result of independent regression and acceptance checks separate from agent test suite."
        },
        "findings_or_behavior_verified": {
          "type": "string",
          "enum": ["not_run", "pass", "fail"],
          "description": "Result of finding quality validation (for review tasks) or new feature behavior acceptance (for development tasks)."
        },
        "protected_state_preserved": {
          "type": "string",
          "enum": ["not_run", "pass", "fail"],
          "description": "Whether protected repository state was preserved without unauthorized modifications. For read-only review, this requires zero repository modifications; for development tasks, this requires that all files and git configurations outside authorized edit scope remain unmodified."
        },
        "check_details": { "type": "object" }
      }
    },
    "limitations": {
      "type": "array",
      "minItems": 1,
      "items": { "type": "string" }
    }
  }
}
